<?xml version="1.0" encoding="UTF-8"?>
<!DOCTYPE claustro SYSTEM "claustro.dtd">

<claustro centro="IES Pepe Botella">
   <profesor id="p1">
      <apelativo>Pepe</apelativo>
      <nombre>José</nombre>
      <apellidos>Suárez Lantilla</apellidos>
      <departamento>Inglés</departamento>
   </profesor>

   <profesor id="p13">
      <apelativo>Cristina</apelativo>
      <nombre>María Cristina</nombre>
      <apellidos>Prieto Monagas</apellidos>
      <departamento>Biología y Geología</departamento>
   </profesor>

   <profesor id="p15">
      <apelativo>Manolo</apelativo>
      <nombre>Manuel</nombre>
      <apellidos>Páez Robledo</apellidos>
      <departamento>Matemáticas</departamento>
   </profesor>

   <!-- Profesor con casillero(s) adicional(es) -->

   <profesor id="p17" casillero="17 43">
      <apelativo>Lucía</apelativo>
      <nombre>Lucía</nombre>
      <apellidos>Gálvez Ruiz</apellidos>
      <departamento>Inglés</departamento>
   </profesor>

   <!-- En principio, si el casillero está vacío
        la aplicación les asigna el que indica su identificador,
        pero se puede asignar uno distinto.
    -->

   <profesor id="p28" casillero="52">
      <apelativo>Miguel Ángel</apelativo>
      <nombre>Miguel Ángel</nombre>
      <apellidos>Campos Sánchez</apellidos>
      <departamento>Historia</departamento>
   </profesor>

   <!-- Profesor sin casillero (tienen el 0) -->

   <profesor id="p81" casillero="0">
      <apelativo>Verónica</apelativo>
      <nombre>Verónica</nombre>
      <apellidos>Martín Díaz</apellidos>
      <departamento>Biología y Geología</departamento>
   </profesor>

   <!-- Profesor sustituto -->

   <profesor id="p86" sustituye="p81">
      <apelativo>Roberto</apelativo>
      <nombre>Roberto</nombre>
      <apellidos>Mínguez Torralbo</apellidos>
   </profesor>
</claustro>
